{
 "id": "hireling-ship-captain",
 "name": "Ship Captain",
 "system": "openfrp74",
 "category": "hirelings",
 "description": "A self-explanatory role.",
 "data": null,
 "special_notes": [
  "cost: 250 GP/month"
 ],
 "related": [],
 "interpretation_records": [],
 "external_refs": [],
 "source": {
  "work": "OpenFRP74",
  "booklet": "v3",
  "page": "p23",
  "blocks": [
   1
  ],
  "content_sha256": [
   "d6a9cb2b2a9c364900271f39069fe7b52825af661e154e21427711782db3f481"
  ],
  "also": [
   {
    "booklet": "v3",
    "page": "p22",
    "blocks": [
     4,
     5
    ],
    "content_sha256": [
     "1af06036a4de8921ce7b44a0ed2079a32724fe75e903ad4a84d329fe6e75c7f1",
     "82be189b9894afd898b7bd52c1bcaa1fbbeb03d1fd007bbdf0cb221c57d2f110"
    ],
    "note": "specialist cost tables"
   }
  ]
 },
 "extraction": {
  "date": "2026-07-17",
  "model": "claude-opus-4-8",
  "notes": null
 }
}
