{
 "id": "hireling-spy",
 "name": "Spy",
 "system": "openfrp74",
 "category": "hirelings",
 "description": "Hired and insinuated, ordered into place, or bought inside the enemy's camp by bribe — with a high chance the bought spy stays honest to his new master. All chances, and all information, flow through the referee.",
 "data": null,
 "special_notes": [
  "cost: 500 GP/mission"
 ],
 "related": [],
 "interpretation_records": [],
 "external_refs": [],
 "source": {
  "work": "OpenFRP74",
  "booklet": "v3",
  "page": "p23",
  "blocks": [
   3
  ],
  "content_sha256": [
   "5f267bf32d8d9da7b65f9d5eaf5edbaefaf1571753cee033ea04067534b278b1"
  ],
  "also": [
   {
    "booklet": "v3",
    "page": "p22",
    "blocks": [
     4,
     5
    ],
    "content_sha256": [
     "1af06036a4de8921ce7b44a0ed2079a32724fe75e903ad4a84d329fe6e75c7f1",
     "82be189b9894afd898b7bd52c1bcaa1fbbeb03d1fd007bbdf0cb221c57d2f110"
    ],
    "note": "specialist cost tables"
   }
  ]
 },
 "extraction": {
  "date": "2026-07-17",
  "model": "claude-opus-4-8",
  "notes": null
 }
}
