{
 "id": "hireling-animal-trainer",
 "name": "Animal Trainer",
 "system": "openfrp74",
 "category": "hirelings",
 "description": "Trains one kind of animal only, about six at a time; required for anything beyond horses and mules. Training time is the referee's.",
 "data": null,
 "special_notes": [
  "cost: 500 GP/month"
 ],
 "related": [],
 "interpretation_records": [],
 "external_refs": [],
 "source": {
  "work": "OpenFRP74",
  "booklet": "v3",
  "page": "p22",
  "blocks": [
   9
  ],
  "content_sha256": [
   "f892ef685d11090dc1ca4e6922773118b3f15b751ac5bb933d63b2bec43d00a4"
  ],
  "also": [
   {
    "booklet": "v3",
    "page": "p22",
    "blocks": [
     4,
     5
    ],
    "content_sha256": [
     "1af06036a4de8921ce7b44a0ed2079a32724fe75e903ad4a84d329fe6e75c7f1",
     "82be189b9894afd898b7bd52c1bcaa1fbbeb03d1fd007bbdf0cb221c57d2f110"
    ],
    "note": "specialist cost tables"
   }
  ]
 },
 "extraction": {
  "date": "2026-07-17",
  "model": "claude-opus-4-8",
  "notes": null
 }
}
